875139:0	875139:0	56	51	negative	Love the scene first off- the place has a character and nice light to it..very fortunate, location wise.
875139:1	875139:1	56	51	negative	The pizza was pretty good and huge.
875139:2	875139:2	56	51	negative	The price very reasonable.
875139:3	875139:3	56	51	negative	We were 4 and got the family size penne a la vodka which was tremendously gigantic portion...a bucket of food literally.
875139:4	875139:4	56	51	negative	We got most of it back at home with us.
875139:5	875139:5	56	51	negative	I would say that all was fine and tasty but the heaviness on my stomach someting that i can't not mention or undermine.
875139:6	875139:6	56	51	negative	The pasta penne was pretty extra buttery, creamy which means a big task to diggest.. tasty at first but i would say that i was full with a slice of pizza and 7 to count, penne...got a little moody afterwards cause was stuffed...lol
929329:0	929329:0	56	51	negative	No, really.
929329:1	929329:1	56	51	negative	I have eaten a lot of pizza here.
929329:2	929329:2	56	51	negative	La Rosa waltzes in, and I think they are doing it the best.
929329:3	929329:3	56	51	negative	Interesting selection, good wines, service fine, fun decor.
935633:0	935633:0	56	51	negative	I have been twice to this restaurant.
935633:1	935633:1	56	51	negative	I love it.
935633:2	935633:2	56	51	negative	I plan on stopping by next week as well.
935633:3	935633:3	56	51	negative	I found it on a cold night, the perfect spot to warm up.
935633:4	935633:4	56	51	negative	I recieved prompt service with a smile.
935633:5	935633:5	56	51	negative	To me it exemplifies Soho, cute, artsy, interesting.
935633:6	935633:6	56	51	negative	Definately check it out!!!
955711:0	955711:0	56	51	negative	This place blew me away...by far my new favorite restaurant on the uppereast side.
955711:1	955711:1	56	51	negative	The wine list is extensive and impressive.
955711:2	955711:2	56	51	negative	LOVE the atmosphere - felt like I was in Paris.
955711:3	955711:3	56	51	negative	The mussels were fantastic and so was the dessert...definitely going to be back very soon.
957145:0	957145:0	56	51	negative	I just read Mocaramel's review and felt compelled to respond.
957145:1	957145:1	56	51	negative	I have been coming here for years and have nothing but good things to say about the service and the great staff at La Lanterna.
957145:2	957145:2	56	51	negative	Over the years the host, Vittorio, and his crew, have always treated me as family--although with all the business this not-so-little gem does, it amazing he's even able to remember a consistent but not-so-frequent visitor.
957145:3	957145:3	56	51	negative	I've also been amazed at all the new additions in the past few years: A new Jazz Bar, the most fantastic Dining Garden, the Best Thin Crust Pizzas, and now a Lasagna Menu which is to die for (these are not your average lasagnas)!
957145:4	957145:4	56	51	negative	I lOVE THIS PLACE!
957145:5	957145:5	56	51	negative	Keep up the good work guys!
958809:0	958809:0	56	51	negative	My girlfiends and I ate at O.G. again last night.
958809:1	958809:1	56	51	negative	I have to say I have never had a disapointing meal here.
958809:2	958809:2	56	51	negative	We could have made a meal of the yummy dumplings from the dumpling menu.
958809:3	958809:3	56	51	negative	Luckily we saved room for the BBQ Salmon, Sea Bass and Crispy Duck.
958809:4	958809:4	56	51	negative	We got a little tipsy from the sake but isn't that what Saturday nights with the girlfriends are all about?
ADLT#8:0	ADLT#8:0	56	51	negative	Love Al Di La
ADLT#8:1	ADLT#8:1	56	51	negative	I recommend this place to everyone.
ADLT#8:2	ADLT#8:2	56	51	negative	Great food.
ADLT#2:0	ADLT#2:0	56	51	negative	One of my favorite places in Brooklyn. 
ADLT#2:1	ADLT#2:1	56	51	negative	The pastas are incredible, the risottos (particularly the sepia) are fantastic and the braised rabbit is amazing.
BFC#4:0	BFC#4:0	56	51	negative	Overpriced and not tasty 
BFC#4:1	BFC#4:1	56	51	negative	The food here was mediocre at best. 
BFC#4:2	BFC#4:2	56	51	negative	It was totally overpriced- fish and chips was about $15.... 
BFC#4:3	BFC#4:3	56	51	negative	There are so many other great places to go to eat and drink..... this place is not worth it...
BHD#9:0	BHD#9:0	56	51	negative	Tasty Dog!
BHD#9:1	BHD#9:1	56	51	negative	An awesome organic dog, and a conscious eco friendly establishment.
BHD#9:2	BHD#9:2	56	51	negative	One of the best hot dogs I have ever eaten.
BHD#9:3	BHD#9:3	56	51	negative	Can't wait to go back.
BzG#1:0	BzG#1:0	56	51	negative	The Cypriot restaurant has a lot going for it.
BzG#1:1	BzG#1:1	56	51	negative	But the best pork souvlaki I ever had is the main thing.
BzG#1:2	BzG#1:2	56	51	negative	Trust me.
BzG#1:3	BzG#1:3	56	51	negative	Run don't walk.
EVPK#10:0	EVPK#10:0	56	51	negative	Super YUMMY Pizza!
EVPK#10:1	EVPK#10:1	56	51	negative	I was visiting New York City with a friend and we discovered this really warm and inviting restaurant.
EVPK#10:2	EVPK#10:2	56	51	negative	I LOOOVE their eggplant pizza, as well as their pastas!
EVPK#10:3	EVPK#10:3	56	51	negative	We had half/half pizza, mine was eggplant and my friend had the buffalo and it was sooo huge for a small size pizza!
EVPK#10:4	EVPK#10:4	56	51	negative	We had fun eating in there, we were there like around 3 a.m. in the morning!
EVPK#10:5	EVPK#10:5	56	51	negative	Will comeback for sure, wish they have it here in LA..
Z#3:0	Z#3:0	56	51	negative	Excellent food, although the interior could use some help.
Z#3:1	Z#3:1	56	51	negative	The space kind of feels like an Alice in Wonderland setting, without it trying to be that.
Z#3:2	Z#3:2	56	51	negative	I paid just about $60 for a good meal, though :)
Z#3:3	Z#3:3	56	51	negative	Great sake!
Y#7:0	Y#7:0	56	51	negative	Reliable, Fresh Sushi
Y#7:1	Y#7:1	56	51	negative	My husband and I take out from here 3-4 times a month.
Y#7:2	Y#7:2	56	51	negative	The sashimi is always fresh and the rolls are innovative and delicious.
Y#7:3	Y#7:3	56	51	negative	Have never had a problem with service save a missing rice once.
Y#7:4	Y#7:4	56	51	negative	Delivery can be spot on or lacking depending on the weather and the day of the week.
Y#7:5	Y#7:5	56	51	negative	Delivery guy sometimes get upset if you don't tip more than 10%.
Y#7:6	Y#7:6	56	51	negative	We've found it to be better and fresher than Kiku which is comparable in price.
Y#3:0	Y#3:0	56	51	negative	Best. Sushi. Ever.
Y#3:1	Y#3:1	56	51	negative	This place has ruined me for neighborhood sushi.
Y#3:2	Y#3:2	56	51	negative	Creative, consistent, fresh.
Y#3:3	Y#3:3	56	51	negative	Excellent sashimi, and the millennium roll is beyond delicious.
Y#3:4	Y#3:4	56	51	negative	Not cheap but very yummy.
Y#3:5	Y#3:5	56	51	negative	Love it.
Y#2:0	Y#2:0	56	51	negative	Very, very nice
Y#2:1	Y#2:1	56	51	negative	The place is a bit hidden away, but once you get there, it's all worth it.
Y#2:2	Y#2:2	56	51	negative	not only is the food
WE#9:0	WE#9:0	56	51	negative	Loved It
WE#9:1	WE#9:1	56	51	negative	My wife and I went to Water's Edge for a romantic dinner.
WE#9:2	WE#9:2	56	51	negative	We had a very nice time.
WE#9:3	WE#9:3	56	51	negative	The waiter was attentive, the food was delicious and the views of the city were great.
WE#9:4	WE#9:4	56	51	negative	I'd definitely go back again.
TR#3:0	TR#3:0	56	51	negative	Great place to relax and enjoy your dinner
TR#3:1	TR#3:1	56	51	negative	There is something about their atmosphere that makes me come back nearly every week.
TR#3:2	TR#3:2	56	51	negative	Place is open till late, no dress code.
TR#3:3	TR#3:3	56	51	negative	Good food: my favorite is the seafood spaghetti.
TR#3:4	TR#3:4	56	51	negative	Highly recommended!
TM#7:0	TM#7:0	56	51	negative	Excellent food for great prices
TM#7:1	TM#7:1	56	51	negative	My husband and I have been sold on this from the first visit.
TM#7:2	TM#7:2	56	51	negative	The wait staff is very courteous and accomodating.
TM#7:3	TM#7:3	56	51	negative	The space is limited so be prepared to wait up to 45 minutes - 1 hour, but be richly rewarded when you savor the delicious indo-chinese food.
TM#7:4	TM#7:4	56	51	negative	There are no negatives to speak of.
RL#7:0	RL#7:0	56	51	negative	the bestt!
RL#7:1	RL#7:1	56	51	negative	my favorite place lol
RL#7:2	RL#7:2	56	51	negative	i love their chicken pasta cant remember the name but is sooo good
RL#3:0	RL#3:0	56	51	negative	its alright
RL#3:1	RL#3:1	56	51	negative	im not necessarily fanatical about this place, but it was a fun time for low pirces.
RL#3:2	RL#3:2	56	51	negative	lobster was good, nothing spectacular.
RL#3:3	RL#3:3	56	51	negative	its just a fun place to go, not a five star restaraunt.
PP#9:0	PP#9:0	56	51	negative	Way below average
PP#9:1	PP#9:1	56	51	negative	I think the pizza is so overrated and was under cooked.
PP#9:2	PP#9:2	56	51	negative	Had no flavor and the staff is rude and not attentive.
PP#9:3	PP#9:3	56	51	negative	Would NEVER go back
PP#4:0	PP#4:0	56	51	negative	I love this place
PP#4:1	PP#4:1	56	51	negative	I wasn't here for the pizza so I can't comment on that yet but what I had was very good.
PP#4:2	PP#4:2	56	51	negative	The service was quick and friendly.
PP#4:3	PP#4:3	56	51	negative	Everyone was smiling so that made me feel welcome.
PP#4:4	PP#4:4	56	51	negative	I thought the restaurant was nice and clean.
PP#4:5	PP#4:5	56	51	negative	I ordered the vitello alla marsala and I was pretty impressed.
PP#4:6	PP#4:6	56	51	negative	The veal and the mushrooms were cooked perfectly.
PP#4:7	PP#4:7	56	51	negative	The potato balls were not dry at all... in fact it was buttery.
PP#4:8	PP#4:8	56	51	negative	The only downside... they only take cash which is OK if you know about it ahead of time.
PP#4:9	PP#4:9	56	51	negative	I'll be back for sure.
P#1:0	P#1:0	56	51	negative	WORST PLACE ON SMITH STREET IN BROOKLYN
P#1:1	P#1:1	56	51	negative	Very immature bartender, didnt know how to make specific drinks, service was so slowwwww, the food was not fresh or warm, waitresses were busy flirting with men at the bar and werent very attentive to all the customers.
P#1:2	P#1:2	56	51	negative	I would never recommend this place to anybody even for a casual dinner.
RL#9:0	RL#9:0	56	51	negative	awesome
RL#9:1	RL#9:1	56	51	negative	the food is always fresh ...
Y#5:0	Y#5:0	56	51	negative	overpriced japanese food with mediocre service
Y#5:1	Y#5:1	56	51	negative	Went here on sat 1/26 and was disappointed.
Y#5:2	Y#5:2	56	51	negative	Chicken teriyaki had tomato or pimentos on top??
Y#5:3	Y#5:3	56	51	negative	food was luke warm.
Y#5:4	Y#5:4	56	51	negative	The waitress was not attentive at all.
Y#5:5	Y#5:5	56	51	negative	I was looking for banana tempura for dessert and they dont have.
Y#5:6	Y#5:6	56	51	negative	Too many other good places to have to settle.
TFS#8:0	TFS#8:0	56	51	negative	Not because you are "The Four Seasons"...  you are allowed to charge an arm and a leg for a romatic dinner.
TFS#8:1	TFS#8:1	56	51	negative	The food was excellent as well as service, however, I left The Four Seasons very dissappointed.
TFS#8:2	TFS#8:2	56	51	negative	I do not think dinner in Manhattan should cost $400.00 where I am not swept off my feet.
Y#4:0	Y#4:0	56	51	negative	Red Dragon Roll - my favorite thing to eat, of any food group - hands down
Y#4:1	Y#4:1	56	51	negative	Just go to Yamato and order the Red Dragon Roll.
Y#4:2	Y#4:2	56	51	negative	If you don't like it, I don't know what to tell you.
Y#4:3	Y#4:3	56	51	negative	The Seafood Dynamite is also otherworldly.
Y#4:4	Y#4:4	56	51	negative	I'm not even going to bother to describe it; it speaks for itself.
Y#6:0	Y#6:0	56	51	negative	Favorite Sushi in NYC
Y#6:1	Y#6:1	56	51	negative	I have eaten at some of the 'best' sushi joints in NYC (Nobu, Bond Street, JewelBako, etc) and Yamato is my favorite.
Y#6:2	Y#6:2	56	51	negative	An unpretentious spot in Park Slope, the sushi is consistently good, the service is pleasant, effective and unassuming.
Y#6:3	Y#6:3	56	51	negative	In the summer months, the back garden area is really nice.
Y#6:4	Y#6:4	56	51	negative	The rolls are creative and I have yet to find another sushi place that serves up more inventive yet delicious japanese food.
Y#6:5	Y#6:5	56	51	negative	The Dancing, White River and Millenium rolls are musts.
RL#4:0	RL#4:0	56	51	negative	SO GOOD
RL#4:1	RL#4:1	56	51	negative	I CAN EAT HERE EVERY DAY OF THE WEEK REALLY LOL LOVE THIS PLACE ...)
P#10:0	P#10:0	56	51	negative	Gross food  Wow-
P#10:1	P#10:1	56	51	negative	I can't remember the last time I had such gross food in New York.
P#10:2	P#10:2	56	51	negative	My quesadilla tasted like it had been made by a three-year old with no sense of proportion or flavor.
P#10:3	P#10:3	56	51	negative	And $11 for a plate of bland guacamole?
P#10:4	P#10:4	56	51	negative	Come on.
P#10:5	P#10:5	56	51	negative	Don't get me started on the margaritas, either.
P#10:6	P#10:6	56	51	negative	Mine tasted like the bartender had forgotten to add the tequila.
P#10:7	P#10:7	56	51	negative	Really, I find it rather scandalous that such a crappy restaurant attracts such crowds--this, in the city of a million restaurants, at least 9/10 of which are way better than this one.
P#10:8	P#10:8	56	51	negative	Save your money and your time and go somewhere else.
P#10:9	P#10:9	56	51	negative	Oh, and I never write reviews--I just was so moved by how bad this place was, I felt it was my duty to spread the word.
TM#3:0	TM#3:0	56	51	negative	Great Indian Food!
TM#3:1	TM#3:1	56	51	negative	This place was reccomended to me by a friend.
TM#3:2	TM#3:2	56	51	negative	When I got there the place was packed but they made sure to seat me quickly.
TM#3:3	TM#3:3	56	51	negative	The food was good, the place was clean and affordable.
TM#3:4	TM#3:4	56	51	negative	I noticed alot of indian people eatting there which is a great sign for an indian place!
TR#1:0	TR#1:0	56	51	negative	This is one of my favorite spot, very relaxing the food is great all the times , celebrated my engagement and my wedding here , it was very well organized .
TR#1:1	TR#1:1	56	51	negative	The staff is very good.
TR#1:2	TR#1:2	56	51	negative	Love their drink menu.
TR#1:3	TR#1:3	56	51	negative	I highly recommend this beautiful place.
TR#8:0	TR#8:0	56	51	negative	Nice for one time special occasion.
TR#8:1	TR#8:1	56	51	negative	Went for Mom's birthday brunch/lunch.
TR#8:2	TR#8:2	56	51	negative	They honored reservation on Sunday afternoon very well. 
TR#8:3	TR#8:3	56	51	negative	Be aware.
TR#8:4	TR#8:4	56	51	negative	We were offered water for the table but were not told the Voss bottles of water were $8 a piece.
TR#8:5	TR#8:5	56	51	negative	Food was OK.
TR#8:6	TR#8:6	56	51	negative	Nice view of river and NYC.
BG#1:0	BG#1:0	56	51	negative	I come here enjoy very much with husband.
BG#1:1	BG#1:1	56	51	negative	Remind me of home.
BG#1:2	BG#1:2	56	51	negative	Great survice
ADLT#4:0	ADLT#4:0	56	51	negative	MMMMMMMMMmmmmmm so delicious
CLF#1:0	CLF#1:0	56	51	negative	A beautifully designed dreamy Egyptian restaurant that gets sceney at night.
CLF#1:1	CLF#1:1	56	51	negative	Watch the talented belly dancers as you enjoy delicious baba ganoush that's more lemony than smoky.
CLF#1:2	CLF#1:2	56	51	negative	Oh, and there's hookah.
P#9:0	P#9:0	56	51	negative	Raymond the bartender rocks!
P#9:1	P#9:1	56	51	negative	Pacifico is a great place to casually hang out.
P#9:2	P#9:2	56	51	negative	The drinks are great, especially when made by Raymond.
P#9:3	P#9:3	56	51	negative	The omlette for brunch is great...
P#9:4	P#9:4	56	51	negative	the spinach is fresh, definately not frozen...
P#9:5	P#9:5	56	51	negative	quacamole at pacifico is yummy, as are the wings with chimmichuri.
P#9:6	P#9:6	56	51	negative	A weakness is the chicken in the salads.
P#9:7	P#9:7	56	51	negative	It's just average, just shredded, no seasoning on it.
P#9:8	P#9:8	56	51	negative	Also, I personally wasn't a fan of the portobello and asparagus mole.
P#9:9	P#9:9	56	51	negative	Overall, decent food at a good price, with friendly people.
BG#6:0	BG#6:0	56	51	negative	Best Indian Restaurant in the City
BG#6:1	BG#6:1	56	51	negative	Decor needs to be upgraded but the food is amazing!
BzG#4:0	BzG#4:0	56	51	negative	This small Astoria souvlaki spot makes what many consider the best gyros in New York.
BzG#4:1	BzG#4:1	56	51	negative	Small, bright, and clean, BZ Grill stands apart from the usual run of gyro joints, both in Astoria and out.
BzG#4:2	BzG#4:2	56	51	negative	What really makes it shine is the food, which is aggressively seasoned with Cyrpriot spices, and all made in-house (even the gyro meat and sausages), and made of much higher quality ingredients that might otherwise be expected.
BzG#4:3	BzG#4:3	56	51	negative	All the various Greek and Cypriot dishes are excellent, but the gyro is the reason to come--if you don't eat one your trip was wasted.
NP#10:0	NP#10:0	56	51	negative	Best restaurant in Brooklyn
NP#10:1	NP#10:1	56	51	negative	The best!
NP#10:2	NP#10:2	56	51	negative	Great food, amazing service, this place is a class act.
NP#10:3	NP#10:3	56	51	negative	The veal was incredible last night.
NP#10:4	NP#10:4	56	51	negative	Fresh, mind blowing flavors.
NP#10:5	NP#10:5	56	51	negative	This place is a must visit!
BHD#2:0	BHD#2:0	56	51	negative	You want to have a real hot dog in Brooklyn?
BHD#2:1	BHD#2:1	56	51	negative	Skip Nathan's...you can get that at the mall...go to Bark.
BHD#2:2	BHD#2:2	56	51	negative	Delicious, creative and fun.
Z#11:0	Z#11:0	56	51	negative	Got a date? Go here!
Z#11:1	Z#11:1	56	51	negative	Every time I have a special occasion with my boyfriend I have a hard time going anywhere else.
Z#11:2	Z#11:2	56	51	negative	It is so romantic.
Z#11:3	Z#11:3	56	51	negative	Its dark, and cozy.. there is always jazz music playing when we go.
Z#11:4	Z#11:4	56	51	negative	Most of the booths allow you to sit next to eachother without looking like 'that' couple.
Z#11:5	Z#11:5	56	51	negative	The food is all shared so we get to order together and eat together.
Z#11:6	Z#11:6	56	51	negative	I've enjoyed 99% of the dishes we've ordered with the only exceptions being the occasional too-authentic-for-me dish (I'm a daring eater but not THAT daring).
Z#11:7	Z#11:7	56	51	negative	Once you try it for a special occasion beware.. you can't stop!
Z#11:8	Z#11:8	56	51	negative	You'll be ther for every anniversary, birthday, valentines day...
WE#4:0	WE#4:0	56	51	negative	For a Fabulous Wedding!
WE#4:1	WE#4:1	56	51	negative	My daughter's wedding reception at Water's Edge received the highest compliments from our guests.
WE#4:2	WE#4:2	56	51	negative	Everyone raved about the atmosphere (elegant rooms and absolutely incomparable views) and the fabulous food!
WE#4:3	WE#4:3	56	51	negative	Service was wonderful;
WE#4:4	WE#4:4	56	51	negative	everyone was cheerfully cooperative and helpful.
WE#4:5	WE#4:5	56	51	negative	Paul, the maitre d', was totally professional and always on top of things.
WE#4:6	WE#4:6	56	51	negative	Thank you everyone at Water's Edge.
WE#4:7	WE#4:7	56	51	negative	Ruth, mother of the Bride
TR#2:0	TR#2:0	56	51	negative	would NOT go back.
TR#2:1	TR#2:1	56	51	negative	Service ok but unfriendly,filthy bathroom.
TR#2:2	TR#2:2	56	51	negative	The high prices you're going to pay is for the view not for the food.
TR#2:3	TR#2:3	56	51	negative	The bar drinks were Eh, ok to say the least.
TR#2:4	TR#2:4	56	51	negative	The stuff tilapia was horrid...tasted like cardboard.
TR#2:5	TR#2:5	56	51	negative	We thought the dessert would be better, Wrong!
TR#2:6	TR#2:6	56	51	negative	$170 down the toilet...
TR#2:7	TR#2:7	56	51	negative	oh speaking of bathroom , the mens bathroom was disgusting.
TR#2:8	TR#2:8	56	51	negative	The floor was wet, the trash can filled with hand towels n all over the floor, no soap, and no hand towels left.
TR#2:9	TR#2:9	56	51	negative	Go to son cubano in edgewater nj instead.
TFS#10:0	TFS#10:0	56	51	negative	Good Experience
TFS#10:1	TFS#10:1	56	51	negative	During our trip to NYC, we made reservations to dine in the pool room of the Four Seasons for their pre-theater menu (offering a modified menu for $65 pp).
TFS#10:2	TFS#10:2	56	51	negative	The wine list was extensive - though the staff did not seem knowledgeable about wine pairings.
TFS#10:3	TFS#10:3	56	51	negative	The bread we received was horrible - rock hard and cold - and the "free" appetizer of olives was disappointing.
TFS#10:4	TFS#10:4	56	51	negative	However, our main course was wonderful.
TFS#10:5	TFS#10:5	56	51	negative	I had fish and my husband had the filet - both of which exceeded our expectations.
TFS#10:6	TFS#10:6	56	51	negative	The dessert (we had a pear torte) was good - but, once again, the staff was unable to provide appropriate drink suggestions.
TFS#10:7	TFS#10:7	56	51	negative	When we inquired about ports - the waitress listed off several but did not know taste variations or cost.
TFS#10:8	TFS#10:8	56	51	negative	Not what I would expect for the price and prestige of this location.
TFS#10:9	TFS#10:9	56	51	negative	All in all, I would return - as it was a beautiful restaurant - but I hope the staff pays more attention to the little details in the future.
Z#9:0	Z#9:0	56	51	negative	short and sweet  seating is great:it's romantic,cozy and private.
Z#9:1	Z#9:1	56	51	negative	The boths are not as small as some of the reviews make them out to look they're perfect for 2 people.
Z#9:2	Z#9:2	56	51	negative	The service was extremely fast and attentive(thanks to the service button on your table) but I barely understood 1 word when the waiter took our order.
Z#9:3	Z#9:3	56	51	negative	The food was ok and fair nothing to go crazy.
Z#9:4	Z#9:4	56	51	negative	over.
Z#9:5	Z#9:5	56	51	negative	Over all the looks of the place exceeds the actual meals.
Z#9:6	Z#9:6	56	51	negative	So what you really end up paying for is the restaurant not the food.
Z#9:7	Z#9:7	56	51	negative	Will prob. not return but it is a great dinning experience to try atleast once.
NP#3:0	NP#3:0	56	51	negative	Impressed...
NP#3:1	NP#3:1	56	51	negative	Subtle food and service
NP#3:2	NP#3:2	56	51	negative	Noodle pudding is exactly the type of service and food I enjoy.
NP#3:3	NP#3:3	56	51	negative	Servers are all different, Greg is my favorite.
NP#3:4	NP#3:4	56	51	negative	Sometimes tables don't understand his sense of humor but it's refreshing to have a server who has personality, professionalism, and respects the privacy of your dinner.
NP#3:5	NP#3:5	56	51	negative	This is the first place I've been that a runner remembers my order... hope he likes his job because I have half a mind to steal him for my restaurant.
NP#3:6	NP#3:6	56	51	negative	Prices are fair across the board for both food and bev.
NP#3:7	NP#3:7	56	51	negative	I go out to eat and like my courses, servers are patient and never rush courses or force another drink.
NP#3:8	NP#3:8	56	51	negative	Restaurants in manhattan should try to model food and service after this place.
BHD#7:0	BHD#7:0	56	51	negative	amazing fresh dogs but best of all endless toppings!!!
BHD#7:1	BHD#7:1	56	51	negative	this place had ALL the trimmings and i mean all.
BHD#7:2	BHD#7:2	56	51	negative	peppers, onions, relish, chilli, cheeses, you NAME it.
BHD#7:3	BHD#7:3	56	51	negative	amazing fun for hot dog lovers of all ages PLEASE do yourself a favor and check this place out!!!!
CLF#5:0	CLF#5:0	56	51	negative	BEST DINING EXPERIENCE IN THE WEST VILLAGE!
CLF#5:1	CLF#5:1	56	51	negative	Stepping into Casa La Femme last night was a true experience unlike any other in New York!
CLF#5:2	CLF#5:2	56	51	negative	Highly impressed from the decor to the food to the hospitality to the great night I had!
CLF#5:3	CLF#5:3	56	51	negative	The have a great cocktail with Citrus Vodka and lemon and lime juice and mint leaves that is to die for!
CLF#5:4	CLF#5:4	56	51	negative	Food took some time to prepare, all worth waiting for.
CLF#5:5	CLF#5:5	56	51	negative	We were drawn into the belly dancing show that captivated the crowd.
CLF#5:6	CLF#5:6	56	51	negative	I never write on these sites but this restaurant is def worth commending!
CLF#5:7	CLF#5:7	56	51	negative	Great find in the West Village!
NP#4:0	NP#4:0	56	51	negative	Maggot in the food!
NP#4:1	NP#4:1	56	51	negative	I've been wanting to go to this place forever and finally got a table.
NP#4:2	NP#4:2	56	51	negative	The menu looked great, and the waiter was very nice, but when the food came, it was average.
NP#4:3	NP#4:3	56	51	negative	Nevertheless, I finished my plate, and that's when I found a maggot in mushroom sauce at the bottom.
NP#4:4	NP#4:4	56	51	negative	I showed it to the manager, and he smilingly apologized and brought us two free desserts (but did not ask us what we wanted and so brought the last two desserts we would have asked for).
NP#4:5	NP#4:5	56	51	negative	When the bill came, nothing was comped, so I told the manager very politely that we were willing to pay for the wine, but I didn't think I should have to pay for food with a maggot in it.
NP#4:6	NP#4:6	56	51	negative	Yes, I ate the food, but I certainly would not have if I had seen the maggot before eating, and I was at this point fairly sick to my stomach.
NP#4:7	NP#4:7	56	51	negative	The manager finally said he would comp the two glasses of wine (which cost less than the food), and made it seem like a big concession.
NP#4:8	NP#4:8	56	51	negative	We paid and left because we didn't feel like arguing any more.
NP#4:9	NP#4:9	56	51	negative	I have worked in restaurants and cook a lot, and there is no way a maggot should be able to get into well prepared food.
NP#4:10	NP#4:10	56	51	negative	For a restaurant with such a good reputation and that is usually so packed, there was no reason for such a lack of intelligent customer service.
FF#1:0	FF#1:0	56	51	negative	A fairly late entry into the haute barnyard sweepstakes, Flatbush Farm isn't in the same league as the Blue Hills or even the Farm on Adderlys of the world, but it's pretty good, albeit with a somewhat dismal setting.
P#6:0	P#6:0	56	51	negative	Unhygienic
P#6:1	P#6:1	56	51	negative	I do not recommend.
P#6:2	P#6:2	56	51	negative	I went there 2times .
P#6:3	P#6:3	56	51	negative	I got hair in my food 2 times of then !
BzG#2:0	BzG#2:0	56	51	negative	Great place, great value.
